{"dataset":"glossary","api_version":"v1","schema_version":"1.1.0","schema_url":"https://blockchains.github.io/blockchainlab-api/v1/schemas/glossary.schema.json","description":"Plain-language blockchain glossary from blockchainlab.com (concepts, protocol profiles, failure classes, stack layers).","generated_at":"2026-10-28T09:42:55.117Z","source":"blockchainlab.com/learn/glossary","source_url":"https://blockchainlab.com/learn/glossary","built_by":"Blockchain Lab — https://blockchainlab.com","licence_note":"Data belongs to the named source; check its terms before reuse. Attribute the source and Blockchain Lab.","count":80,"data":[{"kind":"concept","slug":"blockchain","term":"Blockchain","definition":"A chain of blocks of transactions, each block committing to the one before it.","detail":"A blockchain is a replicated log. Changing an old entry means rebuilding every later commitment, in public, against everyone else who has the log. It does not, by itself, create legal title, identify a person, or make a price.","url":"https://blockchainlab.com/learn/concepts/blockchain?utm_source=github&utm_medium=open-data-api&utm_campaign=blockchainlab-api"},{"kind":"concept","slug":"distributed-ledger","term":"Distributed ledger","definition":"A shared record more than one party keeps. A blockchain is one design for that record.","detail":"Not every shared database is a blockchain. The useful question is who is allowed to write, and what happens when two honest copies disagree.","url":"https://blockchainlab.com/learn/concepts/distributed-ledger?utm_source=github&utm_medium=open-data-api&utm_campaign=blockchainlab-api"},{"kind":"concept","slug":"hash","term":"Hash","definition":"A short fingerprint of a longer input. The same input always gives the same fingerprint. A small change gives a different one.","detail":"Hashes chain blocks together and commit to a set of transactions. They do not hide the input if the input is short or guessable.","url":"https://blockchainlab.com/learn/concepts/hash?utm_source=github&utm_medium=open-data-api&utm_campaign=blockchainlab-api"},{"kind":"concept","slug":"merkle-tree","term":"Merkle tree","definition":"A tree of hashes, so a small proof can show that one item sat inside a large set.","detail":"Light clients use this to check inclusion without storing every transaction. The proof says the item was committed. It does not say the item was true in the world.","url":"https://blockchainlab.com/learn/concepts/merkle-tree?utm_source=github&utm_medium=open-data-api&utm_campaign=blockchainlab-api"},{"kind":"concept","slug":"public-key","term":"Public key","definition":"A key you can publish. Other people use it to check a signature or to derive an address.","detail":"Publishing it does not let them spend. Losing the matching private key usually means losing the ability to authorise.","url":"https://blockchainlab.com/learn/concepts/public-key?utm_source=github&utm_medium=open-data-api&utm_campaign=blockchainlab-api"},{"kind":"concept","slug":"private-key","term":"Private key","definition":"The secret that authorises a signature. Whoever can use it can act as that key.","detail":"Custody is the question of who can use this secret, under what policy, and what happens when a person or a device is gone.","url":"https://blockchainlab.com/learn/concepts/private-key?utm_source=github&utm_medium=open-data-api&utm_campaign=blockchainlab-api"},{"kind":"concept","slug":"wallet","term":"Wallet","definition":"Software or hardware that holds keys and builds transactions. The assets stay on the ledger.","detail":"A wallet is not an account at a bank unless a custodian sits behind it. A watch-only wallet holds no key and cannot spend.","url":"https://blockchainlab.com/learn/concepts/wallet?utm_source=github&utm_medium=open-data-api&utm_campaign=blockchainlab-api"},{"kind":"concept","slug":"custody","term":"Custody","definition":"Who can move the asset, and under what rule.","detail":"Self-custody means the holder controls the keys. Third-party custody means someone else can move them, usually under a contract and a policy. Blockchain Lab does not hold customer assets.","url":"https://blockchainlab.com/learn/concepts/custody?utm_source=github&utm_medium=open-data-api&utm_campaign=blockchainlab-api"},{"kind":"concept","slug":"mpc","term":"MPC","definition":"Multi-party computation: a signature made by several parties without any one of them holding the whole key.","detail":"It changes the failure mode from one stolen file to a threshold of parties. It does not remove the need for a policy, a recovery path, or a vendor you can sue.","url":"https://blockchainlab.com/learn/concepts/mpc?utm_source=github&utm_medium=open-data-api&utm_campaign=blockchainlab-api"},{"kind":"concept","slug":"multisig","term":"Multi-signature","definition":"A rule that more than one key must sign before a spend.","detail":"The rule is visible on some chains and hidden inside a contract or a vendor on others. Read where the rule actually lives.","url":"https://blockchainlab.com/learn/concepts/multisig?utm_source=github&utm_medium=open-data-api&utm_campaign=blockchainlab-api"},{"kind":"concept","slug":"hsm","term":"HSM","definition":"A hardware security module: a device that holds key material and performs signing inside a boundary.","detail":"An HSM is a control, not a strategy. You still need who may ask it to sign, and what happens if the device or the operator fails.","url":"https://blockchainlab.com/learn/concepts/hsm?utm_source=github&utm_medium=open-data-api&utm_campaign=blockchainlab-api"},{"kind":"concept","slug":"consensus","term":"Consensus","definition":"How a network chooses one history when more than one is possible.","detail":"Different papers answer different questions: open membership, a known validator set, or random sampling. The paper and the live network can diverge.","url":"https://blockchainlab.com/learn/concepts/consensus?utm_source=github&utm_medium=open-data-api&utm_campaign=blockchainlab-api"},{"kind":"concept","slug":"proof-of-work","term":"Proof of work","definition":"The right to propose a block is bought with computation that anyone can check.","detail":"The cost is energy and hardware. The security claim is that rewriting history costs more than it pays, not that rewriting is impossible.","url":"https://blockchainlab.com/learn/concepts/proof-of-work?utm_source=github&utm_medium=open-data-api&utm_campaign=blockchainlab-api"},{"kind":"concept","slug":"proof-of-stake","term":"Proof of stake","definition":"The right to propose or vote is tied to an asset that can be penalised.","detail":"Stake can be concentrated, delegated, or locked. A yield figure is not the security argument.","url":"https://blockchainlab.com/learn/concepts/proof-of-stake?utm_source=github&utm_medium=open-data-api&utm_campaign=blockchainlab-api"},{"kind":"concept","slug":"finality","term":"Finality","definition":"The point after which a block is not expected to be replaced.","detail":"Probabilistic finality means the chance falls over time. Deterministic finality means a quorum has voted. A product should say which one it means.","url":"https://blockchainlab.com/learn/concepts/finality?utm_source=github&utm_medium=open-data-api&utm_campaign=blockchainlab-api"},{"kind":"concept","slug":"smart-contract","term":"Smart contract","definition":"A program the ledger will run, with the result written into the shared state.","detail":"It is not a contract a court has read. If the code and the legal agreement disagree, you have two systems, not one.","url":"https://blockchainlab.com/learn/concepts/smart-contract?utm_source=github&utm_medium=open-data-api&utm_campaign=blockchainlab-api"},{"kind":"concept","slug":"virtual-machine","term":"Virtual machine","definition":"The rules for how contract code executes and how it is metered.","detail":"Two chains can both say smart contract and still be unable to run each other's code.","url":"https://blockchainlab.com/learn/concepts/virtual-machine?utm_source=github&utm_medium=open-data-api&utm_campaign=blockchainlab-api"},{"kind":"concept","slug":"oracle","term":"Oracle","definition":"A bridge from a fact outside the chain to a value inside it.","detail":"The chain can check the signature. It cannot check the world. The committee, the sensor, or the exchange that signed is the trust assumption.","url":"https://blockchainlab.com/learn/concepts/oracle?utm_source=github&utm_medium=open-data-api&utm_campaign=blockchainlab-api"},{"kind":"concept","slug":"bridge","term":"Bridge","definition":"A mechanism that lets an asset or a message be represented on another system.","detail":"Many bridges are a set of keys that lock value on one side and issue a claim on the other. The risk is those keys, the code, and the time between the two.","url":"https://blockchainlab.com/learn/concepts/bridge?utm_source=github&utm_medium=open-data-api&utm_campaign=blockchainlab-api"},{"kind":"concept","slug":"rollup","term":"Rollup","definition":"Execution happens off the base chain. A proof or a challenge window connects the result back.","detail":"Ask whether the transaction data is published, who can force an exit, and how long a challenge takes.","url":"https://blockchainlab.com/learn/concepts/rollup?utm_source=github&utm_medium=open-data-api&utm_campaign=blockchainlab-api"},{"kind":"concept","slug":"data-availability","term":"Data availability","definition":"Whether the contents of a block were actually published, not just the header.","detail":"If the data was withheld, users may be unable to check the state or exit. Scaling designs split on this point.","url":"https://blockchainlab.com/learn/concepts/data-availability?utm_source=github&utm_medium=open-data-api&utm_campaign=blockchainlab-api"},{"kind":"concept","slug":"zero-knowledge","term":"Zero-knowledge proof","definition":"A proof that a statement is true without revealing why, beyond what the statement itself says.","detail":"The proof can hide an amount or a path. It does not hide